{
  "schema_version": 2,
  "game_code": "power655",
  "country_code": "VN",
  "operator_code": "vietlott",
  "dataset_version": "2026.10.08.001",
  "dataset_updated_at": "2026-10-08T17:26:40Z",
  "record_count": 1406,
  "sha256": "9c8473d40728a1957d115c21eee6edef1d50aa9c68d9f89d06d6c0d0ac81c8c1",
  "byte_size": 281260,
  "rulesets_sha256": "ded3d99c677ca89c2275847eb2f5611e1cb41d502fa0ca8720d309b35875fc6d",
  "first_draw_id": "00001",
  "first_draw_date": "2017-08-01",
  "latest_draw_id": "01407",
  "latest_draw_date": "2026-10-06",
  "missing_draw_ids": [
    "00944"
  ],
  "ruleset_ids": [
    "power655_v1"
  ],
  "provenance": {
    "original_source": "Publicly available Vietlott result information (https://vietlott.vn)",
    "acquisition_method": "conversion",
    "source_name": "viettran88/vietlott-data",
    "source_url": "https://github.com/viettran88/vietlott-data",
    "source_dataset_version": "2026.10.07.001",
    "source_sha256": "fb859d851895537330d43432ba7714985d0d7fd0797b5e51fd3ce132d4b3276a",
    "retrieved_at": "2026-10-07T14:33:00Z",
    "normalized_at": "2026-10-08T17:26:40Z",
    "notes": "Converted from the Vietlott-only repository (schema 1) without re-collecting; every draw is identical. That repository's records were bootstrapped from vietvudanh/vietlott-data at a632f03feeb227a74f8da70979a31fd4126efa83 (see PROVENANCE.md). Full history: metadata/audit_log.jsonl."
  },
  "generator": "lottostat-lotto-data/2.0.0"
}
